1. insa 테이블에서 각 부서별 사원수 조회
SELECT COUNT(*)  
FROM insa e
GROUP BY buseo;
2. insa 테이블에서 각 부서별 급여를 가장 많이 받는 사원의 pay를 출력
     1) UNION ALL 사용해서 풀기
SELECT BUSEO,NAME,BASICPAY+SUDANG pay
FROM insa 
WHERE BASICPAY+SUDANG = (SELECT max(BASICPAY+SUDANG)FROM insa WHERE  buseo = '총무부')
UNION ALL
SELECT BUSEO,NAME,BASICPAY+SUDANG pay
FROM insa 
WHERE BASICPAY+SUDANG = (SELECT max(BASICPAY+SUDANG)FROM insa WHERE  buseo = '기획부')
UNION ALL
SELECT BUSEO,NAME,BASICPAY+SUDANG pay
FROM insa 
WHERE BASICPAY+SUDANG = (SELECT max(BASICPAY+SUDANG)FROM insa WHERE  buseo = '영업부');

     2) GROUP BY  사용해서 풀기
SELECT buseo, MAX(BASICPAY+SUDANG)
FROM insa
GROUP BY buseo;

     3) 상관 서브쿼리 사용해서 풀기
SELECT *
FROM insa i
WHERE BASICPAY+SUDANG in((SELECT MAX(BASICPAY+SUDANG)FROM insa WHERE i.buseo = buseo));

3. 이번 달이  몇 일까지 있는 지 출력하세요. 
SELECT LAST_DAY(SYSDATE)
FROM dual;
4. 다음 주 월요일은 휴강일이다.. 몇 일인가요 ? 
SELECT NEXT_DAY(SYSDATE,'월')
FROM dual;
5. emp 테이블에서
   각 사원들의 입사일자를 기준으로 10년 5개월 20일째 되는 날 ? 
    [실행결과]
        HIREDATE ADD_MONT
        -------- --------
        80/12/17 91/06/06
        81/02/20 91/08/12
        81/02/22 91/08/14
        81/04/02 91/09/22
        81/09/28 92/03/18
        81/05/01 91/10/21
        81/06/09 91/11/29
        81/11/17 92/05/07
        81/09/08 92/02/28
        81/12/03 92/05/23
        81/12/03 92/05/23 
        82/01/23 92/07/12
        
        12개 행이 선택되었습니다.
SELECT HIREDATE, ADD_MONTHS(hiredate,125)+20  ADD_MONT
FROM emp
ORDER BY  ADD_MONT;

6.  insa테이블에서 1001, 1002 사원의 주민번호의 월/일 만 오늘 날짜로 수정하는 쿼리를 작성 
UPDATE insa
SET ssn = SUBSTR(ssn,1,2)||TO_CHAR(SYSDATE,'MMDD')||SUBSTR(ssn,7)
WHERE num in(1001,1002);
                     
6-2.  insa테이블에서 오늘('2023.03.21')을 기준으로 아래와 같이 출력하는 쿼리 작성.  
   ( DECODE 함수 사용. )
    결과)
    장인철	780506-1625148	생일 후
    김영년	821011-2362514	생일 전
    나윤균	810810-1552147	생일 후
    김종서	751010-1122233	오늘 생일
    유관순	801010-2987897	오늘 생일
    정한국	760909-1333333	생일 후
SELECT name, ssn, 
DECODE(SIGN(MONTHS_BETWEEN(TO_DATE(TO_CHAR(SYSDATE,'YY')||SUBSTR(SSN,3,4)),'2023.03.21')),-1,'생일 후',1,'생일 전','생일')birth
FROM insa;

6-3. insa테이블에서 오늘('2023.08.30')기준으로 이 날이 생일인 사원수,지난 사원수, 안 지난 사원수를 출력하는 쿼리 작성. 
[실행결과 예]
  생일 전 사원수   생일 후 사원수  오늘 생일 사원수
---------- ---------- ----------
        48         12          0    
SELECT 
    SUM(DECODE(SIGN(MONTHS_BETWEEN(TO_DATE(TO_CHAR(SYSDATE,'YY')||SUBSTR(SSN,3,4)), SYSDATE)), -1, 1, 0)) AS "생일 후",
    SUM(DECODE(SIGN(MONTHS_BETWEEN(TO_DATE(TO_CHAR(SYSDATE,'YY')||SUBSTR(SSN,3,4)), SYSDATE)), 0, 1, 0)) AS "오늘 생일",
    SUM(DECODE(SIGN(MONTHS_BETWEEN(TO_DATE(TO_CHAR(SYSDATE,'YY')||SUBSTR(SSN,3,4)), SYSDATE)), 1, 1, 0)) AS "생일 전"
FROM insa i;        


SELECT COUNT(*)
FROM insa i
WHERE  SIGN(MONTHS_BETWEEN(TO_DATE(TO_CHAR(SYSDATE,'YY')||SUBSTR(SSN,3,4)),SYSDATE))=-1;


7. 함수 설명 
    7-1. NULLIF() 함수 설명 a와 b 비교후 같으면 null 반환
    7-2. COALESCE() 함수 설명  인수중에서 NULL이 아닌 첫 번째 인수를 반환
    7-3. DECODE() 함수 설명    if문 과 비슷 여러개의 조건을 주어 조건에 맞을 경우 해당 값을 반환 비교 연산은 '='만 가능하다
    7-4.            LAST_DAY() 함수 설명 해당달의 마지막 날짜 반환
    7-5. ADD_MONTHS() 함수 설명 특정 개월 수를 더한 날짜를 출력하는 함수
    7-6. MONTHS_BETWEEN() 함수 설명  2개의 날짜간의 개월수를 리턴
    7-7.            NEXT_DAY() 함수 설명 가장가까운 요일의 날짜 반환
    7-8. EXTRACT() 함수 설명
    
     ㄱ. ASCII() 함수 설명 문자를 ascii코드로 반환
     ㄴ. CHR() 함수 설명 ascii코드를 그에 맞는 문자로 반환
     ㄷ. GREATEST() 함수 설명 목록중 가장 큰값 반환
     ㄹ. LEAST() 함수 설명 목록중 가장 작은 값 반환
     ㅁ. UPPER() 함수 설명 문자를 대문자로 변경
     ㅂ. LOWER() 함수 설명 문자를 소문자로 변경
     ㅅ. LENGTH() 함수 설명 문자열 길이 반환
     ㅇ. SUBSTR() 함수 설명 문자열에서 특정 위치부터 특정 갯수까지 문자 추출
     ㅈ. INSTR() 함수 설명         문자열에서 특정 문자가 있는 위치 반환
     
8.  TO_CHAR( date  ,  'format') 함수에서 'format'에 사용되는 기호를 적으세요.
  ㄱ. 년도 : YYYY
  ㄴ. 월 :  MM
  ㄷ. 월의 일 : DD
      주의 일 :  D
      년의 일 : DDD
  ㄹ. 요일 : DAY, DY
  ㅁ. 월의 주차 : W
      년의 주차 : WW, IW
  ㅂ. 시간/24시간 : HH, HH12, HH24
  ㅅ. 분 : MI
  ㅇ. 초 :  SS
  ㅈ. 자정에서 지난 초 : SSSSS
  ㅊ. 오전/오후 :      AM,PM

9. 본인의 생일로부터 오늘까지 살아온 일수, 개월수, 년수를 출력하세요..     
     SELECT 
         SYSDATE, TO_DATE('98/03/11')생년월일
        , ROUND(SYSDATE - TO_DATE('98/03/11'))일수
        , ROUND(MONTHS_BETWEEN(SYSDATE,TO_DATE('98/03/11')),1)개월수
        , ROUND(MONTHS_BETWEEN(SYSDATE,TO_DATE('98/03/11'))/12,1)년수
FROM dual;
10. IW와 WW 의 차이점.    
WW: 매년 1일부터 1주차, 7일 기준으로 다음주차로 넘어감
IW: 매년 1일이 금토일 이면 전해의 마지막 주차, 월~목 이면 올해의 첫 주차.
	(월~일)요일 기준으로 일요일 지나고 월요일이 되면 다음 주차

11-1. 이번 달이 몇 일까지 있는 확인.
SELECT TO_CHAR(LAST_DAY(SYSDATE),'DD')
FROM dual;

11-2. 오늘이 년중 몇 째 주, 월중 몇 째주인지 확인. 
SELECT TO_CHAR(SYSDATE, 'IW'),TO_CHAR(SYSDATE, 'W')
FROM dual;

12. emp 에서  pay 를 NVL(), NVL2(), COALESCE()함수를 사용해서 출력하세요.
SELECT ename, NVL(sal+comm,sal), NVL2(comm,sal+comm,sal), COALESCE(sal+comm,sal)
FROM emp;

12-2. emp테이블에서 mgr이 null 인 경우 -1 로 출력하는 쿼리 작성
      ㄱ. nvl()
      ㄴ. nvl2()
      ㄷ. COALESCE()
SELECT ename, NVL(mgr,-1), NVL2(mgr,mgr,-1), COALESCE(mgr,-1)
FROM emp;

13. insa 에서  이름,주민번호, 성별( 남자/여자 ), 성별( 남자/여자 ) 출력 쿼리 작성-
    ㄱ. DECODE()
SELECT name,ssn, DECODE(MOD(SUBSTR(ssn,8,1),2),1,'남자','여자')gender
 FROM insa;

    ㄴ. CASE()  안 배움. X
SELECT name, ssn,
        CASE MOD(SUBSTR(ssn,8,1),2) WHEN 1 THEN '남자'
                                    --WHEN 0 THEN '여자'
                                    ELSE '여자'
        END gender,
        CASE
            WHEN  MOD(SUBSTR(ssn,8,1),2) = 1 THEN '남자'
            ELSE '여자'
        END gender
FROM insa;

14. emp 에서 평균PAY 보다 같거나 큰 사원들만의 급여합을 출력.
  ( DECODE 풀이 ) 

15. emp 에서  사원이 존재하는 부서의 부서번호만 출력
15-2. emp 에서  사원이 존재하지 않는  부서의 부서번호만 출력

16. 아래 코딩을  DECODE()를 사용해서 표현하세요.
    ㄱ. [자바]
        if( A == B ){
           return X;
        }
    
    ㄴ. [자바]
        if( A==B){
           return S;
        }else if( A == C){
           return T;
        }else{
           return U;
        }
    DECODE(A,B,S,C,T,U)
    ㄷ.  [자바]
        if( A==B){
           return XXX;
        }else{
           return YYY;
        }
DECODE(A,B,XXX,YYY
)
17. emp 테이블에서 10번 부서원들은  급여 15% 인상
                20번 부서원들은 급여 10% 인상
                30번 부서원들은 급여 5% 인상
                40번 부서원들은 급여 20% 인상
  하는 쿼리 작성. 
SELECT e.*, DECODE(deptno,10,pay*1.15,20,pay*1.1,30,pay*1.05,pay*1.2)인상급여
 FROM (SELECT deptno, ename, sal+NVl(comm,0)pay FROM emp)e;  


18. emp 테이블에서 각 부서의 사원수를 조회하는 쿼리
  ( 힌트 :  DECODE, COUNT 함수 사용 )  
 SELECT COUNT(DECODE(deptno,10,1)),COUNT(DECODE(deptno,20,1)),COUNT(DECODE(deptno,30,1)),COUNT(DECODE(deptno,40,1))
 FROM emp;